Sentences,Aspects,Sentence Sentiment,Aspects Sentiment
انصح أصدقاء في لن جدا رائع شكراااااااا سوق كوم على خدمتكم المميزة,خدمة,1,1
استخدمته خلال يومين . وتجربتي له كانت جيدة,تجربة,1,1
أنصح به لمواصفاته العالية وسعره المميز,"مواصفات،سعر",1,"1, 1"
#NAME?,,1,
ممتاز وسعرة مناسب جدا,سعر,1,1
جميله جدا ورائعه الوصف واشكر كل من قام في شراء هذه السلعه الجميله التي تعطيك جو الاستحمام الحقيقي واراحه,"الوصف،السلعه",1,"1, 1"
بصراحة تستحق خمسة نجوم حلوه جدا شكل  جميل وعلى الصوت وعلى الفلاش وسعرها مرة رخيص بالنسبة للأجهزة الأخرى بصراحة اللي يشتريها مايندم,"شكل،سعر",1,"1, 1"
السلعه جدا رائعه,السلعه,1,1
سلعة ممتازة وحجم صغير,"سلعة،حجم",1,"1, 1"
هاتف رائع انصح به سهل في التعامل سلس رائع في التصوير ولو كنت اتمنى ان تكون الكاميرا الخلفيه على الاقل ١٦ ميغا بكسل بدل ١٣ البطاريه ممتازه جدا.,"هاتف،التعامل،البطاريه",1,"1, 1, 1"
رووعه جميله,,1,
جهاز عملي وجبار اذا كنت تدور جهاز اندريد فهاذا جهاز جبار وفائق الاداء جدا جدا روعه وانصح فيه,جهاز,1,1
نيكسس هاتف ذكي خفيف الوزن ونظام اندرويد حديث,"نيكسس،نظام اندرويد",1,"1,1"
مشلكة وحيدة وهي تأخر استجابة الجهاز في بعض الأوقات,,0,
مطابقة للمواصفات والمقاييس المذكورة في العرض,مواصفات,1,1
رائع وسهل الاستخدام,الاستخدام,1,1
جيد جدا وعملي,,1,
بجد قمة الروعة في كل شيء تصميم.إمكانيات تصوير نقاء صوت مذهل سرعة في الأداء.  زملائه. شاريها من ٤ أيام . بسم الله ماشاء  الله.. و انا مجرب    HTC wailedfire  من قبل .قمة الاتقان..,"تصميم،إمكانيات تصوير،نقاء  صوت،الأداء،الاتقان",1,"1, 1, 1, 1, 1"
عملي والبطاريه تدوم وصغير وتتش جيد,البطاريه,1,1
جدا رائعة ومناسبة السعر جدا,السعر,1,1
هذا الجهاز ممتاز وقوي يوفي بالغرض فيه بعض من المميزات الجميله نوكيا غنيه عن التعريف قيمه مناسبه مع الامكانيه الجميله للجهاز,"الجهاز،المميزات،نوكيا،الامكانيه",1,"1, 1, 1, 1"
جهاز رائع وصلني جديد وبتغليف المصنع مميزاته رائعه وانصح الجميع باقتناءه,"جهاز،تغليف المصنع",1,"1, 1"
مناسب بالنسبة لسعره,سعر,-1,1
جهاز قوي جدا ويتحمل وصلب ومميزاته قويه جدا ولكن سعره عالي حيث سعره بالسوق والمحلات ارخص من سعركم فيرجي مراجعة السعر حتي نستطيع شرائه,"جهاز،مميزات،سعر",1,"1, 1, -1"
ممتاز وسعره مناسب جدا بالنسبه لامكانياته والتوكيل محترم,"سعر،التوكيل",1,"1, 1"
لا يوجد به فلاش للكاميرا ودقة الكاميرا سيء,دقة الكاميرا,-1,-1
أكثر من ممتاز,,1,
"- إيجابيات و سلبيات سامسونج جالكسي I9105 اس2 بلس ‫(8 جيجابايت , أندرويد ,كحلي غامق):",,1,
منتج رائع من كل النواحي,منتج,1,1
السعر نااااار,السعر,-1,1
موبيل جميل,موبيل,1,1
تم توصيل الموبايل في اقل من 24 ساعة وهذه فترة وجيزة جدا ...,فترة,0,1
الجهااز ممتاز جدا,الجهااز,1,1
وحش اوي,,1,
الكاميرا ضعيفة والجهاز يعلق احيانا,"الكاميرا،الجهاز",-1,"-1, -1"
خفيف الوزن سهل الاستعمال جودته مقبوله,"الوزن،الاستعمال،جودة",0,"1, 1, 1"
نحن نثق بسوق دوت كوم,,1,
سرعة الجهاز بفضل البروسيسرو والرام والكاميرا جيدة جدا  خفيف جميع التطبيقات تعمل بشكل رائع علية  الفلاش قوى وجميل جدا والبطارية ممتازة تبقى لمدة يومين تقريبا مع الاستخدام العادى,"سرعة الجهاز،التطبيقات،الفلاش،البطارية",1,"1, 1, 1, 1"
سئ سئ سئ,,-1,
عملي ويشغل شريحتين,,1,
"التليفون جيد ومناسب جدا للعمل،حيث البطارية  تدوم مع الاستهلاك العادي حوالي 3 أيام أو أكثر،وهو خفيف الوزن","التليفون،الوزن",0,"1, 1"
حصلت عليه باقل من الف ريال من موقعهم,,-1,
جديده فعلا وارخص من السوق,,1,
جدا ممتازه من حيث الشكل والاستخدام والاداء فهو الاسم العريق بلاك بيري بـ نظام 10 الجديد كلياً من ناحية الاستخدام,"الشكل،الاستخدام،الاداء",1,"1, 1, 1"
يجب تخفيض السعر ليتناسب مع بقيه العروض,,-1,
"الموبايل جميل جدا , خامة ممتازة تاتش سريع نت جميل مع الملاحظة ان الموبايل من الفئات المنخفضة ولا يجوز مقارنته بالفئات العالية حيث انه عملى جدا و انا اشتريته كتليفون للعمل فقط الى جانب ذلك فجميع التطبيقات تعمل عليه بسلاسة و كفاءة عالية ....الكاميرا ضعيفة جدا لمن يهتم بامر الكاميرا غير ذلك فانه هاتف ممتاز جدا و الخطين يعملون عليه بكفاءة ... امكانية مرضية الى حد كبير بالنسبة لسعره ....التوصيل ممتاز ولا يستغرق اكثر من يومين .... شكرا لموقع سوق","الموبيل،خامة،تاتش،نت،الفئات،التطبيقات،كفاءة،الكاميرا، هاتف",1,"1, 1, 1, 1, -1, 1, -1, 1, 1"
جهاز ممتاز+ سماعة داخلية واضحة +صوت رائع +حجم الشاشة كبير,"جهاز،سماعة داخلية،صوت،حجم الشاشة",1,"1, 1, 1, 1"
جداً رائع خاصة بنظام التشغيل الخام بدون زيادات من قوقل,,,
السلعه سيئه ولا تصلح للاستخدام . البطاريه جدا ضعيفه .بشكل عام السلعه غيرجيده .استخدمت الموبايل لفتره قصيره لصعوبة استخدامه ك موبايلي عادي ولا توجد به اي مميزات واللون الذهبي عالاطراف غير مكتمل يشبه الموبايلات المقلده واعتقد انه تقليد مب اصلي,"السلعه،البطاريه،اللون",-1,"-1, -1, -1"
انصح الكل بشرائه,,1,
ان شاء الله مش اخر مره اشترى من سوق كوم صديق ليا شكروه في سوووق كوم كتيير وكلامو طلع فى محلو اتمنى لكم التوفيق,,1,
"سلعة ليست بالمواصفات المطلوبة ،هنالك عيب خطير وهو أن الجهاز يسخن كثيرا ،ويعلّق ويعيد تشغيل نفسه !!!",,-1,
سلعه جيده نوعا ما ولكن الافضل منها m2 aqua ضد الماء والغبار,سلعه,1,0
من الاخر ممتاز وانا احببتة,,1,
بطيء يتعلق كثيرًا,,-1,
الجهاز غير صالح للاستخدام وخاصة لو قررت انك تستخدمو مكان جهاز افضل منو,"الجهاز،جهاز",-1,"-1, 1"
حسب استخدامك انت فالجهاز مميز وذو اناقه بالغه مما يجعلة من الانواع المميزة,"الجهاز،الانواع",0,"1, 1"
يتميذ التلفون بانة يجمع كل المميزات الواجب توافرها فى اى تلفون مع خفة الوزن وضغر الحجم والشكل الجميل وهذا كلة فى طول 8سم وعرض 3سم,"التلفون،الوزن،الحجم،الشكل",1,"1, 1, 1, 1"
تعامل راقي من الاخ عمرو,تعامل,1,1
جهـاز رائع حجم ومواصفات وجميع مايرغغبه مستخدمي الجوالات الحديثة فيه جميع المواصفات التي تجعل منه جهاز كويس,جهاز,1,1
الجهاز بالنسبه لسعره فهو رائع,الجهاز,0,1
لايوجد تقييم للمنتج,,-1,
فى بعض البروشورات وجت الرام 1 جيجا وفى أخرى وجدتها 2 جيجا غريب الموضوع ده فعلاً,,1,
جهاز خارق,جهاز,1,1
السلعة جيدة و رخيصة و ذات مواصفات جيدة. و أحببت أن اشتري من سوق دوت كوم لكي لا أنزل للسوق بسبب الزحام و غيره.,"السلعة،مواصفات",1,"1, 1"
الشاحن خربان والبطاريه تفضى بسرعه للاسف,"الشاحن،البطارية",0,"-1, -1"
التليفون اكثر من رائع وتم استلامه بعد يومين من عمل الاورد مغلف وبضمان الوكيل  شكرا لـ سوق وشكراً لـ,التليفون,1,1
عملي وجميل والسعر مناسب بالنسبة لامكاناته الكبيرة.     واسم 'سامسونج من ضمان مميز وهو من الجيل الرابع وهذا شي مميز,"السعر،امكانات،ضمان",1,"1, 1, 1"
رهيب بمعنى الكلمة,,1,
منتج رائع وأنصح بشراؤه,منتج,1,1
جدا راائعه,,1,
سلعه ممتازه وعمليه وخفيفه وجمعت ساعه اليد وهاتف,سلعه,1,1
شكرا للبائع,,1,
أرجو تعديل عنوان المنتج من أجل المصداقية التي تعودنا منكم,,1,
افضل جوال سامسونج هيكل قوي ونظام مبدع جميل الشكل مضاد للأتربة والماء شكله مميز عن باقي جوالات سامسونج المتميزة بالنعومة," هيكل،نظام،شكل،جوالات سامسونج",1,"1, 1, 1, 1"
جيد و التوصيل جيد,التوصيل,1,1
سيئ جدا جدا جدا كتقييم عام و تفصيلا .. الكاميرا لا تصل ابدا ل 13 ميجا بيكسل و رديئه فى الاماكن المغلقه و لا تصل ل 1 ميجا من الاساس و الوانها غير طبيعية و جودة الصورة عموما سيئه الذاكرة الداخلية ليست 4 جيجا بايت و انما 1.6 جيجا بايت الهاتف يسخن جدا عند تشغيل الانترنت مع 3G network و يفصل الشريحة التى تشغل الانترنت فيكون بلا قيمة من الاساس الشبكة ال 3G موجودة على الشريحة الاولى فقط لا يمكن تحديث النظام الى اصدارات احدث من نظام الاندرويد ال GPS غير دقيق بالمره فهناك فرق فى االمكان الذى يظهرك فيه بحوالى 400 او 600 متر دائما ولا يصدف ان يظهرك فى مكانك و لو مره واحده,"تقييم،الكاميرا،الوان،جودة الصورة",-1,"-1, -1, -1, -1"
مشاء الله مواصفات عجيبه,مواصفات,1,1
جهاز متميز من هواوي بسعر منافس جدا,"جهاز،سعر",1,"1, 1"
مطابق تماما للمواصفات.,,1,
موبايل جامد اوى وبرستيش,موبايل,1,1
مثل الجالكسي اس 4 اللهم انه ضد الماء والغبار وجودة التصوير اقل منه وفيه اختلاف في الشكل ومتوفر بثلاث الوان يعني شوي يبي له مجازفة.,"جودة التصوير،الوان",0,"-1, -1"
سلعة جميلة جدا وبائع ممتاز وسعر ممتاز كذلك,"سلعة،بائع،سعر",1,"1, 1, 1"
جهاز رائع .. انيق .. حجم مناسب جدا ..و خفيف الوزن .. انصح به,"جهاز،حجم،الوزن",1,"1, 1, 1"
جهاز جميل وحجمه رائع ولكن مرفقاته وخاصة السماعه ليست لشركة لينوفو حيث رأيت فديو يوتيوب به المرفقات ولاحظت السماعه عليها اسم المنتج وتفاجأت ان السماعه اللتي جاءت مع المنتج سيئه ورديئة الصنع فاأرجو من الوكيل ملاحظة هذا الشيء وشكرا,"جهاز،حجم،السماعه اللتي جاءت مع المنتج",1,"1, 1, -1"
شكر الى موقع سوق على مصدقيته فى مواصفات التليفون والخدمه المميزه فى تسليم السلع,الخدمه,1,1
جيد نوعا ما,,0,
بصراحه اشتريته على بالي فيه واتس دام فيه تويتر وفيس بوك بس تفاجأت انه مافيه ولايدعمه هالجهاز,,-1,
نعم ينصح به,,1,
قمت بطلب هذا الجهاز وتبين انه لا يحتوي على لغة عربية,,,
"الكاميرا جميله ورائعه وانا اعطي الجهاز اربع نجوم بسبب النظام هو ينزل عليه اغلب برامج المحادثة مثل الواتس اب والاسكاي بي والاين وغيرها ,,,",الكاميرا,1,1
شلش مرة,,-1,
لو كان سعره اقل وفيه فلاش كنت قيمته اكار من كدا.... فشل واضح من سوني انها ماحطتش ليه فلاش...................,"سعر،قيمة",-1,"-1, -1"
عملى ومناسب,,-1,
"اشتريت السلعة على اساس أنها جديدة ،ولكني فوجئت بها مستعملة وفيها عطل في باور الكهرباء حيث إن الهاتف يخسر الكهرباء بسرعة رغم أني اشتريت بطارية جديدة أصلية","السلعة،بطارية",-1,"-1, 1"
هذا الجهاز من أكثر اﻻجهزه روعه فى جوالات سامسونج ألوانه ودقه شاشته ليس لها مثيل وبطاريته قويه جدا وله كاميرا عاليه الدقه,"بطارية،كاميرا",1,"1, 1"
ممتاز ومواصفاتها ممتازة والصوت جدا عالي وواضح,"مواصفات،الصوت",1,"1, 1"
سعر مبالغ فيه جداً جداً جداً,سعر,-1,-1
موبيل ممتاز وانصح بشراءه,موبيل,1,1
الحالة ممتازه التغليف اكثر من رائع مع السرعه في التوصيل,"الحالة،التغليف،التوصيل",1,"1, 1, 1"
مافيش ولا اروع ولا احلى من كده بصراحة,,1,
رائع سأنصح اصدقائى به,,1,
الموبايل امكانياتة جبارة وخفيف في شغلة وسريع جدا,امكانيات,1,1
جيدة وذات امكانيات كثيرة وتتناسب مع احتياجاتي ولون الجهاز رائع,"امكانيات،لون الجهاز",1,"1, 1"
جهاز ممتاز استفدت منه خصوصا لكبار السن  وكذلك صوته عالي مع إمكانية اختيار نوع التنبية ومسافة استقباله جيده,"جهاز،صوت،مسافة استقبال",1,"1, 1, 1"
غاركينيا كامبوغيا مستخلصات نباتية,,1,
ممتازه لسعرها و جودة الصوت يفوق السعر ملمس رائع وخفيفه جدا وصغيره جدا واكثر من رائعه ...............................................ز,"الصوت،ملمس",1,"1, 1"
جميل جداً وسعره يفوق الخيال و سهل الإستخدام وكيوت شكراً للبائع.,"سعر،الإستخدام",1,"1, 1"
انها جدا مميزه وجميلة,,1,
السلعة رائعه ولا يوجد بها عيوب,السلعة,1,1
رائع جدا للاستخدام وسهل استخدامه واشياء كثييره,استخدام,1,1
السلعة غالية وسيئة (اسوء سماعات اشتريتها),"السلعة،سماعات",-1,"-1, -1"
لمن يبحث عن أغلام كرتون مميزة لا يتردد,,1,
لا اكون صريحة السلعة بها الكثير من الاشياء السيئة,,-1,
أحببته من كل قلبي وأنصح به لجميع العاملين بالأعمال المكتبية وحتى الأعمال الفنية .. لان تقنيته عالية وموفر للوقت,تقنية,1,1
سعر الجهاز فى المرسلات (الرياض) كان 200-2100 و سعر الشراء من سوق.كوم كان 1799 ريال .. كم أنت عظيم يا سوق.كوم!,سوق.كوم,1,1
تجربه جديده في عالم ابل .. استخدام بسيط الوان مبهجه ..,"استخدام،الوان",1,"1, 1"
السعر مبالغ فيه كثيرا اسعار بلاك بيري في نزول مع العلم ان هذا الجهاز اول إصدارات النظام الجديد وكان يعاني من بعض المشاكل,السعر,-1,-1
جهاز مفيد,جهاز,1,1
السلعة ممتازة جدا وانا من فترة كنت اتمني ان املكها لكي تسهل عليه التعامل مع الجوال بكل سهولة في نقل الملفات المعلومات,السلعة,1,1
المنتج جيد جدا والشاشة عالية النقاء والقدرة العالية للبطارية,"المنتج،الشاشة،القدرة",1,"1, 1, 1"
السلعه ممتازه ولكن يجب كتابه بلد المنتج ( امركي -بريطاني)  توضيح ذلك عن طريق الاحرف الموجوه خرج العلبه,السلعه,1,1
جهاز اكثر من رائع وانا بستخدمة وبنصح بشراءة لانة فعلا رفيق الحية,جهاز,1,1
السلعة اكثر من ممتازة,السلعة,1,1
الجهاز سعته كبيرة,سعة الجهاز,1,1
فلاش ميموري مزدوج للاب توب والهواتف الذكية والتابلت 8 جيجابايت ممتازة وشكلها متميز وصغيرة الحجم وسهلة وبسيطة دون اي شك,"شكل،الحجم",1,"1, 1"
الشكل جميل وملفت للنظر,الشكل,0,1
استخدام وشكل وحجم السلعه مناسب جدا,"استخدام،شكل،حجم السلعه ",1,"1, 1, 1"
بائع جيد وسريع في الشحن. سعر السلعه جدا رائع . السلعه ممتازه واعجبتني صراحه,"بائع،سعر السلعه،السلعه",1,"1, 1, 1"
سلعة ممتازة بسعر جيد.. انصح بها,"سلعة،سعر",1,"1, 1"
ممري عملي ممتاز .. مفيد للجهزه الكمبيوتر و النقال,ممري,1,1
سعره مناسب جدا,سعر,1,1
قطع ممتازه لو صار اي شي بجوالك ممكن تستخدم الشريحه على اي جهاز,قطع,1,1
سلعة جيدة و سعرها مناسب و ملائمة تماما لمقاس الهاتف يعيبها فقط زر الغلق ليس بالمرونة الكافية كنت اتمنى ان يكون اكثر مرونة,"سلعة،سعر",1,"1, 1 "
جيده وانصح باستخدامها,,1,
رائعه,,1,
اكثر من راىع,,1,
سلعه سيئه والبائع اسلوبه سئ للغايه ولا انصح بها  ولا اعطيه نجمه واحده,"سلعه،اسلوب البائع",-1,"-1, -1"
جيد ولكن لايوجد بكرتونة المنت مغلف بكيس,,1,
ليس عملي,,-1,
هذا السلفي ستيك مافيه اي ازرار !!,,-1,
ممتازه جد وارخص بكثير من سعر الخارج,,1,
حيد حدآ,,1,
المنتج جيد وسعره مناسب جدا,"المنتج،سعر",1,"1, 1"
العصا اعجبتني جداً خصوصاً انك لاتحتاج الى ان تلمس الجوال لكي تاخذ الصورة,العصا,1,1
الاطارف الاماميه تعدم الاستكر,,1,
سماعه جيده وخفيفه الوزن وصوتها قوي بالنسبه لحجمها,"سماعه،الوزن،صوت",1,"1, 1, 1"
سلعه جميله جدا,سلعه,1,1
يا ليت تخفضوا أسعارها بحدود 150- 200 ريال .,,0,
تساعد على إبتكار أفكار جديدة من خلال التصوير للهواة,,1,
جهاز ممتاز خصوصاً ان الريموت مدمج وليس خارجي معرض للفقدان,جهاز,1,1
أشكر على القائمين على السوق لطرح مثل هذه المنتجات التي يحتاجها كل شخص,,0,
اخي العزيز شكرا لك على ارسالك الشحنه تم استلامها ولايوجد ابدا تأخير من قبلك,,1,
"الكفرد جداً حلو انصح أشراء المنتج,",الكفرد,1,1
بعد استخدام عدة اشهر  المحفظة لاتزال كالجديدة وخامتها ممتازة جدا,"المحفظة،خامة",1,"1, 1"
توصيل البائع كان ممتاز لاكن التأخير من ارامكس كالعادة السلعة كانت كما في الوصف وسعرها افضل سعر موجود ويعتبر رخيص جدا مخصص اكثر للجوالات وجيده نوعا ما على الكاميرات,"توصيل البائع،السلعة،سعر",-1,"1, 1, 1"
"انا جربت استكر ديكولك  المميز فيه انه سهل التركيب يعني مايحتاج خبرة ومع الخلفية الشاشة يصير الجوال مختلف تماما،يعني لو مليت من الجهاز اعطيه  استكر يصير شي ثاني،تصاميم حلوة يعني فيها افكار","استكر ديكولك،التركيب،الخلفية،تصاميم",1,"1, 1, 1, 1"
صناعه ممتازة جدا وجلد رائع,"صناعه،جلد",1,"1, 1"
"كفراصلي ورائع من شركة رهيبه , تم وصول القطعة بالوقت المحدد والتغليف ممتاز اشكركم","كفر،الوقت،التغليف",1,"1, 1, 1"
صناعه ممتازة جدا,صناعه,1,1
منتج جيد وسعر مناسب وتوافر هذا النوع من الكفرات لهواوي شيئ جيد,"منتج،سعر",1,"1, 1"
الجراب جميل شكلاً ومضموناً قوي وتصميمة أنيق ومصقول بحيث يغطي كافة مخارج الجهاز بشكل دقيق,"الجراب،تصميم،شكل",1,"1, 1, 1"
السلعه للاسف تلفت من اول استخدام لها - السبب انها مائعه جدا  ليست مستويه صلبه - اول عمليه سحب منها تتحول الي قطعه متداخله صعبه الفك والرجوع لوضعها الطبيعي,السلعه,-1,-1
اكثر من راىع وباذن الله سوف اشتري باستمرار من سبايجن لانه عجبني جدا جدا جدا,,1,
صناعه ممتازة,صناعه,1,1
جيدة عموما,,1,
المنتج ممتاز ولو كان سمارت كفر يركب مكان غطاء البطاريه لاصبح افضل,المنتج,1,1
منتج ذو جودة عالية و انصح به,"منتج،جودة",1,"1, 1"
التغليف كان بصورة ممتازة ... انصح بها ... للذين يشتكون من انتهاء البطارية بسرعة,التغليف,1,1
ممتازه وعمليه وان جدا مبوسط لاقنتاءها واحب اشكر سوق علي حسن اختيار منتجاتها,,1,
شكله على الجوال رهيييييييييييب,شكل,1,1
اللصقة اصغر من حجم الجوال حيث تبقى الاطراف مكشوفة بشكل واضح,"اللصقة،الاطراف،شكل",-1,"-1,-1,1"
تؤدي الغرض منها ومصنوعة بطريقة مناسبة ومن مواد جيدة وانصح بامتلاكها لمن لا يحبون اخذ المحفظة معهم وخصوصا وقت الدوام,,1,
السلام عليكم ورحمه الله,,0,
لم اتوقعها هكذا كنت اتمناها بمواصفات ذكية تناسب مستوى الايفون,,-1,
ممتازة ومطابقة للوصف والصور ونحيفة جداً و من خامة ممتازة وتم شحنها في وقت أسرع من المتوقع لها وشكراً للتاجر  ...,"خامة،شحن",1,"1, 1"
أعجبني تطابق الحواف ووجود اسبير لزر التشغيل عدد 2 ولكن أصبح الجوال أكثر وزناً بشكل ملفت وأزعجني وجود لاصق على غلاف الشاشة من الداخل لم أستطع تنظيفه,الحواف,1,1
ممتازه سوق كوم مافيه زيه اتمنى بس يجيبوا سمارت واتش 3 واي شي جديد ينزلوه بسرعه            وشكراااااااااا,,1,
الة ممتازة خامتها جيدة بكامل اغراضعا والتوصيل خلال الفترة المذكورة انصح بشرائها لمحبين السيلفي وصور السيلفي و في السفريات تصلح تصور نفسك بنفسك مع خلفية المنظر,"الة،خامتها",1,"1, 1"
النوعيه ممتازه واتمنى ان تتوفر اكسسوارت ال جي اكثر,النوعية,1,1
افضل موقع سوق لشراء المنتجات التجارية,موقع,1,1
بعد تركيبة بيومان بداء ظهوار هواء داخلي !!!!,,-1,
راي إنه حلو أعجبني راح أخذ مثلو إكون اللون الأسود,,1,
