Sentences,Aspects,Sentence Sentiment,Aspects Sentiment
ممتازة بصراحه مريحة خاصتا في الخرجات الي من غير عربية,,1,
المنتج عملي,المنتج,1,1
جيد نوع,نوع,0,1
اشتريت السلعه ودفعت ثمنها من الماستر كارد وتم ابلاغي انه تم ارجاعها ولا اعلم السبب,,-1,
شنطة جميلة وأنيقة وسعرها مناسب جدا,"شنطة،سعر",-1,"1, 1"
الشنطة حلوه,الشنطة ,1,1
هذا السرير (أو المحجر كما يسمى) ممتاز ... نوم ولعب بأمان خاصة للأطفال الرضع أقل من 3 سنوات.,"السرير،محجر",1,"1, 1"
لعبة مفيده,لعبة,1,1
مرااا حلوة احلى شيء انها تجمع اكتر من شيء بمكان واحد يعني اغتنام مساحهة ومنظمة ومرتبة وكل شي قريب من البيبي .. واجهت صعوبة بس في فتح السرير .. والطريقة كانت واضحة باليوتيوب اكتبو طريقة تركيب سرير الاطفال,"السرير،الطريقة",1,"1, 1"
هذه السلعه ممتازة جدا وفريدة من نوعها,السلعه,1,1
شكرا لكم على خدمتك,,0,
تم توصيل السلعة الى المنزل بحالة ممتازه في وقت قصير وهي اداة مفيدة جدا لإراحة الأهل من تفقد الأطفال كل فترة,"السلعة،اداة",1,"1, 1"
منتج رائع جداً وانصح فيه,منتج,1,1
السلعة تستحق القيمة التي دفعتها فيها ( 30 ريال). عيبها الوحيد أن البائع رفع السعر إلى الضعف! لا أنصح بشرائها بهذا السعر المبالغ فيه. لا تستحق أن تدفع فيها 60 ريال.,"السلعة،السعر",0,"1, -1"
جميع منتجات السلامة لطفل ممتازة,منتجات,1,1
رائعه وعملية. قوة الشفط مناسبة للاطفال غير مؤذية. يمكن استعمالها للانف او للفم لكن يجيب تنظيفها. سهلة الشحن و الحمل و الاستعمال والتنظيف. انصح بإقتنائها.,"الشفط،الشحن،الحمل،الاستعمال،التنظيف",1,"1, 1, 1, 1, 1"
السلعة رديئة وقد تلفت من اول استخدام  نوعية الشاش المستخدم خفيف جدا  ويتمزق بسهولة عند اي استخدام واذا تمزق فقدت خاصيتها بمنع البعوض,"السلعة،نوعية الشاش المستخدم",-1,"-1, -1"
كرة ممتازة للاطفال,كرة,1,1
نوعيه ممتازه رائحه منديل ملمسه ناعم ورائحته زكيه وهو عباره عن منديل مرطب مع لوشن  وانا معجب من سوق لسرعه التوصيل انا اشكرا علي الموضوع دا,"منديل،ملمسه،رائحته،التوصيل",1,"1, 1, 1, 1"
مجموعة متنوعة وممتاز مناسب للسفر,مجموعة,1,1
المنتج ممتاز ومتعدد الانواع,المنتج,1,1
الحقيقه الفستان اعجبني بس مافهمت نقطة بنات 4 الي 5 سنوات والحجم من 12 الى 18 شهر انا عندي بنت عمرها 4 سنوات وابي اشتري على قدها ممكن تفيدونا,الفستان,1,1
ممتازة للطفل وحافظة لعينيه بعد الله من دخول الشامبو فيها جودتها نوعاما غريبة لكن تفي بالغرض شكرا لكم,جودة,1,-1
"سلعة ممتازة جدا"" يمكنني السماع من خلال الجدران والحواجز بوضوح أنصح بها ويمكنك أخافض الصوت ورفعة للسماع أوضح",سلعة,1,1
مناسبه للأعياد والحفلات,,1,
- إيجابيات و سلبيات بدلة تخسيس رياضية ‫(2XL):,,1,
غير مناسبة لمن يريد الحصول على جسم مشدود تصلح لصاحب جسم مشدود اساسا لاظهار تفاصيل جسمه,,-1,
رائع وانصح به للذي يملك ترهلات فقط,,1,
سلعة ممتازه والتسليم أكثر من جيد من ناحية زمن التسليم كما ان سعرها ممتاز ولا توجد بها أي سلبيات وشكرا لكم,"سلعة،زمن التسليم،سعر",1,"1, 1, 1"
المنتج حلو كتير,المنتج,1,1
حافظة عملية تغنيك عن حمل المحافظ الكبيرة و المزعجة للجيب ... باستطاعتك الوصول للكرت المهم في وقت قصير جداً,"حافظة،محافظ،الكرت",1,"1, 0, 0"
تحتوي على جيب بسحاب و مواقع كثيرة للبطاقات و حجمها متوسط,حجم,1,0
القلم أفضل أما المحفضه سيئة جدا ورديئه الخام,"القلم،المحفظه",-1,"1, -1"
اعجبني بشده وانصح به جميع من يعانون من الام في الظهر وخاصة الاشخاص الذين لا يستطيعون اقامة ظهرهم بالشكل الطبيعي المطلوب,,1,
القلم لايطابق المواصفات المذكورة,القلم ,-1,-1
المنتج رائع,المنتج,1,1
فعلاً بتحافظ على الكروت جدا لانها معدن بس كنت اتمنى ان تكون مفصلات الحافظه اقوى وعموماً هى شكلها جميل جدا وبتجذب اى حد شافها معايا بيقوللى بتتباع فين,"مفصلات الحافظه،شكل",1,"-1, 1"
سلعة رائعة بالضبط هي السلعة التي كنت أبحث عنه,سلعة,1,1
لا بأس بها لكن لم يعجبني حجمها الكبير مشوه منظر المحفظه !,"حجم،منظر المحفظه",0,"-1, -1"
لا تكفي لاكثر من ثلاث او اربع بطاقات والسعر مبالغ فيه يعني حوالي 100 ريال,سعر,-1,-1
ممتازة لو تأتي في كرتون خاص فيها لتكون هدية قيمة,,1,
الحمدلله والصلاة والسلام على رسول الله ...نوعية ممتازة وصلت مغلفة بعناية و في وقت مناسب,"نوع،وقت",1,"1, 1"
ممتازه من ناحية اشكل الانيق,اشكل,1,1
شماغ رائع ومميز,شماغ,1,1
المنتجات رائعة وعمليه وشيك جدا,المنتجات,1,1
المنتجات روعه ومطابقه للصوره,المنتجات,1,1
قلم رائع,قلم,1,1
جلد طبيعي وجودة عالية,جلد,1,1
قلم ممتاز بالنسبة للسعر واسم الماركة اسعار شيروتي بالنسبة للاكسسوارات الرجالية اقلام ومحافظ وكبكات,قلم,1,1
جميلة وانيقة ولكن ارى انها صغيره,,1,
"مساء الخير،وصلني القلم اليوم لكن للأسف الدائرتين التي تظهر في الصورة باللون الأحمر مختلفة عن الواقع حيث أن القلم الذي وصلني الدائرة لونها أصفر",القلم,-1,-1
المنتجات غير متطابقه مع صورة العرض,المنتجات,1,-1
انيقه وجميله وفعلاً عصريه  وتتسع لي البطاقات والاموال  والاوراق الشخصيه  والهاتف الشخصي واعطيها تقيمي الشخصي  بي خمس  نجوم,,1,
"السلعة أكثر من رائعة بالنسبة لي ومصنوع من خامة ممتازة و أنيق جدا ومن أجمل ما قمت بشرائه على متجر سوق كوم الرائع،،،","السلعة ،خامة",1,"1, 1"
اذا كانت كما في الصورة فهي من ارقاء انواع الاقلام .,الاقلام,0,1
محفظة مفاتيح رائعة وعملية وخفيفة.,محفظة مفاتيح,1,1
المنتج جيدجداا,المنتج,1,1
المنتجات لا انصح احد بشرائها,المنتجات,-1,-1
شكرا لتوفير هذه الغترة الرائعة وأتمنى زيادة عدد القطع المعروضة للبيع. فهذه المرة الثانية التي أقوم بشراء هذه السلعة .,الغترة,1,1
ممتازه ونوعيه طيبه وشكراً على هذه السلعه ونتمنى التقدم والزياده فموقعكم وفر لنا الشي الكثير فجزاكم الله خير,السلعه,1,1
المنتج غير جيدة ولا انصح به,المنتج,-1,-1
كل شي ممتاز العيب الوحيد تاخر وصلها فقط,وصل,1,-1
مستواها جيد ولابد من اضافة الشركة المصنعة في المميزات حتى يتسنى للمستهلك نوع الشركة ويكون على دراية تامة في اتخاذ القرار وهومطمئن اكثر مماهو مذكور في المميزات ولكم جزيل الشكر على تيسير خدمة الشراء ابتداء من الشراء حتى استلام السلعة,مستوى,0,1
اعطي اكبر من حجمه اضعاف مايستحق,حجم ,-1,-1
الصورة و الوصف يختلف تماما عن السلعة التي استلمتها,,1,
خامة يابانية ممتازة وعالية الجودة,خامة يابانية,1,1
المقاس مختلف عن المقاس المطلوب,المقاس,-1,-1
قلم ذو شكل فخم وانسيابي عند الكتابة!,قلم ,1,1
السلعة سيئة وخامتها سيئة جدا وغير عملية ولا تقوم بشد الجسم بالشكل المطلوب  واتقطعت في أول يوم استخدام,"السلعة،خامة",-1,"-1, -1"
خفيف الوزن وانيق والسعر ممتاز,"الوزن،السعر",1,"1, 1"
#NAME?,,0,
شكلها روعه لاكن اللون مو ذهبي فاقع نفس الصوره شوي افتح,"شكل،اللون",-1,"1, -1"
السلعة جيده وذو نوعيه رائعه وشكرا على خدمة رائعه منكم,السلعة,1,1
جميل  اتمنا الجديد,,0,
الشريط الداخلي يطلع من مكانه وتتوسع المحفظة وتصير بدون فائدة,,-1,
جيد جدا للبطاقات للناس التي تحب الاحتفاظات بالبطاقات في السياره كالرخص والهويه وبطاقات الصراف,,1,
جيدة وعملية وتقوم بشد ترهلات الجسم وخاماتها ممتازة .... لكن مشكلتها انها صعبة في الارتداء,,1,
حجمها صغير ورائعه المظهر خصوصا اللو الذهبي,حجم,1,1
عملية ولها اكثر من استخدام وسعرها مناسب,سعر,1,1
السلعة ليست بالجودة المطلوبة  وقد اشتخدمتها لمرة واحدة فقط ولم ارجع لاستخدامها مرة ثانية .,السلعة,0,-1
جميل جدا والاجمل شكله وكتابته,"شكل،كتابة",1,"1, 1"
جهاز سيئ جدا منتج رديئ وجوده رديئه ولا يستحق اى مبلغ. ولا انصح به احد,"جهاز،منتج",-1,"-1, -1"
المكيف جوده سيئة ولا يوجد تبريد إطلاقا لم استفد منه و المبلغه المدفوع فيه مبالغ فيه لعدم وجود تبريد اعرف المكيفات الصحرايه لاكن ليس بجوده هذا المكيف,"المكيف،المبلغه",-1,"-1, -1"
"السعر مره غالي انا شريت نفس الفلتر هذا بحوالي ٤٥٠ يغطي ٢٤ متر مربع من اكسترا بتقريبا ٤٥٠ ريال ،و هنا ما احد ذاكر المساحه اللي يغطيها اذا كان نفس الحجم ،فسعره غالي و ادا كان يغطي مساحه اكبر فيمكن يستاهل !! و تحياتي",السعر,-1,1
جهاز مفيد وعملي,جهاز,1,1
بصراحة عملية و تؤدي الغرض في سرعة التبخير .. ولكن مشكلة الحرارة في بدن القلم بعد الإستخدام مزعجة,"سرعة التبخير،الحرارة",0,"1, -1"
جدآ رائعة و صلتني في الوقت المحدد,,1,
ممتازة وخفيفة وسريعة لكن  الافلام غير متوفرة,,1,
انصح فيها وجدا سعرها مناسب,سعر,1,1
"سلعة غير عملية , حاولت مرارا وتكرارا استخدمها ولكنها لاتطبع الروسومات , يؤسفنى تقييمها بهذا الشكل فهى سلعة غير جيدة لاتؤدى وظيفتها البتة , لا تخاطر بشراءها .",سلعه,-1,-1
واسعه بتشيل كل حاجه ومبطنه من الداخل علشان مافيش حاجه تتكسر جواها الاسود بتاعها جميل والسوست قويه سهله الحمل لاي مكان ممكن ف شنطه اليد كمان بس تكون الشنطه ف الحجم الوسط او الكبير,شنطه يد,1,1
المنتج جيد لابأس به,المنتج ,1,1
رائع وسهل الاستخدام. ينظف المناكير الخارج من حدود الظفر. يوجد رأسين احتياطي للتبديل في حالة عطب الرأس المستخدم.,,1,
عديمة الفائدة وسعرها غير مناسب,سعر,-1,-1
جهاز عملي وسريع ومختصر للوقت في تنظيف البشرة اشكرك ع السعر المميز الله يبارك لك في مالك يارب ويكثر من امثالك,"جهاز،سعر",1,"1, 1"
ممتااااااااااااااااااااااااااااااز,,1,
المنتج رائع - الشحن سريع - متابعة فائقة الجودة من موقع سوق - البائع امين - ساكرر تجربة الشراء من موقع سوق - شكرا موقع سوق - شكرا للبائع - شكرا لشركة ارامكس - مع تحياتي,"المنتج،الشحن،البائع",1,
راااائعه,,1,
ممتازة جدا وذات جودة  ولجودتها ولاكتمال المواصفات ومصداقيتها,,1,
ساعطي الفرش ذات الشعر الاحمر تقييم: متوسط.,الفرش ذات الشعر الاحمر,-1,0
المقص ليس عملي ونتائجه سيئة للغاية,"المقص،نتائج",-1,"-1, -1"
رووووووعه,,1,
الفرش جدا جميله وعمليه وسعرها جدا مناسب من افضل الفرش الي استخدمتها انصح فيها بشدة وتم وصولها بافضل حاله اسعدني التعامل معك,"الفرش،سعر",1,"1, 1"
شعر الفرشاة جداً ناعم وسعرهاً جداً مناسب شكراً,"شعر الفرشاة،سعر",1,"1, 1"
الخامه سيئه والسوسته ضعيه وسريعه التلف,"الخامه،السوسته",-1,"-1, -1"
أتمنى تطويرها لتصبح قطعتين معاً والمقاس يمكن التحكم به,,1,
رائع لكن يفضل علي البائع سرعة التوصيل,,1,
نفس الطلب بحذاقيره ... رائع ... سريع ... دقة ... نظافة ... متعة ... مغامرة في كل رسمة ... ذوق في الرسمات الناعمة جدا جدا جدا ... شكر خاص للبائع الصادق ... وشكر خاص لـ ((( سوق كوم ))),الرسمات ,1,1
رائحته جميله ويقوم بالعناية بالبشرة بطريقة لطيفة .. أضف إلى ذلك انه سعره رائع من البائع samiiiii  بمبلغ 30 ريال فقط,"رائحه،سعر",1,"1, 1"
الوان رائعه وجذابه لحبيبات الكافيار لتزيين المناكير. سرعة التوصيل. السعر مناسب. للاسف لاتحتوي على أداة لوضع الحبيبات على المناكير.,"الوان،السعر",1,"1, 1"
#NAME?,,1,
صابونة اكثر  من رائعة  ونتائجها ممتازة .. واهم شي انها طبيعية  مية بالمية ..,صابونه,1,1
جيده جداا وانصح بشرائها لانها مريحه جدا وتساعد في ترتيب وتنظيف اظافر القديمين ولا تستهلك جهد كثير ولا وقت  طويل,,1,
عملية وخفيفة وتساعد على ترتيب المظهر,,1,
اكثر من رائع .. وكان تعامل المندوب في قمه الذوق,,1,
"السلعة ممتازة،انا جربتها من شخص قبل ما اطلبها ولكن للاسف بعد ما وصلتني زعلت لان التغليف كان سئ مما ادى الى ان السلعة لم تكن صالحة للاستخدام","السلعة،التغليف،السلعة",1,"1, -1, -1"
المنتج جيد وكما في الصورة و حسب ماتم اختيارة وسعره ممتاز وتم وصولة وهو بحالة ممتازة و تم وصولة في وقت قياسي .,"المنتج،سعر،وقت",1,"1, 1, 1"
السلعة ممتازة وسعرها مناسب والبائع سريع في ارسال الشحنات..ويسرني التعامل معه مستقبلاً,"السلعة،سعر،البائع",1,"1, 1, 1"
روائح جميلة..,روائح,1,1
ننصح بهذا المنتج كونه منتج اساسي لمحبين التصوير بالسيارة والاسطح اللمساء,المنتج,0,1
thanks great item i ever have so i will use it with my canon really love them,,1,
نوعية الخامه جدآ عجبتني وشكلها جميل وانيق,"نوع الخامه،شكل",1,"1, 1"
السعة جيدة مقارنة بسعرها..ويعيبها ضعف قاعدة الشفط..,السعة,-1,1
منتج ممتاز لكن سعره غالي,"منتج،سعر",1,"1, -1"
جييد,,1,
جيده جدا  والبائع سريع فى شحن البضاعه,البائع,1,1
المنتج جيد جدا من ناحية المواد المصنعه وسهل الاستخدام  ويوجد حقيبة جميله       بطل,"المنتج،حقيبة",1,"1, 1"
خفيف الوزن ومصنوع من الالمنيوم,الوزن,1,1
لا انصح بها أبداً و صعبة الاستخدام لسوء صنعها ........................................................................,,-1,
رسوماتها كبيره وجميله ومختلفه وتوصل بسرعه وتطبع بسرعه وجيدة الصنع معاها كرستالات للزظافر وملقط للكرستالات وواداة تنقيط ممتازه واختصرت علي شراء الادوات,رسومات,1,1
تم استلام السلعه فى الوقت المحدد ..,السلعه,1,1
رائعه وشكلها انيق وتناسب الرجال والنساء وقمت بطلب عدد 4,شكل,1,1
ممتازة جدا ... ناعمة على البشرة جدا ... فخامة ... ألوان جذابة مريحة نفسيا ... شكر خاص لمصداقية البائع ... وشكر خاص لــ ((( سوق كوم ))),البشرة,1,1
جودة المنتج ضعيفه ..ولكن سعرها جيد,"المنتج،سعر",-1,"-1, 1"
جدا رائعه وانصح فيها بقوه,,1,
منتج غير جيد,منتج ,-1,-1
ممتاز جداً وذو جودة عالية ويستاهل قيمته,جودة,1,1
ممتازه جداً انها رائعه للتصوير وومتازه جداً انصح بها الجميع خاصة المصورين بتكون لهم جدا ممتازه وتضبط للمناظر,التصوير,1,1
جيد للكاميرات الخفيفة,,-1,
بالنسبه للتصوير جيده جدا ولكن نظرا لحجمها الصغير جدا فانها تمثل عيبا فى حملها ولمس الشاشه وغيره.,"التصوير،حجم",-1,"1, -1"
اخيس كاميرا انصحكم بعدو عنها اسألوا مجرب    ابعدو نصيحة لحد يشريه شفوها عندي اذا حولت المقاطع للجوال يطلع الصوت مقطع وتزعجك بالتصوير التقائي وﻻ معها بطاريه يعني ﻻزم تشبكها بالبطاريه دايم,كاميرا,-1,-1
ممتازة جدااا,,1,
لا يوجد,,1,
تصويرها ليس جيد وليست HD ..وتصوير غير واضح سيئه جدا...والصوت ليس جيد...كام سيئة بمعنى الكلمه..استخدمتها مره وحده ورميتها,"تصوير،صوت",-1,"-1, -1"
منتج جميل جدا,منتج,1,1
اعتبر انها مفيدة لبعض الاشخاص  خصوصا الذين يودون تحويل الاشرطة القديمة الى سي دي وكذلك في النقل المباشر,,1,
أصلي ١٠٠ %,,1,
منتج رائع وانصح اي شخص فيه بس اتمنى البائعين يبيعوا للاجهزة الاخرى زي الHTC One M8/GALAXY S5/Sony Z3...,منتج,1,1
ماشاء الله جميلة و ساعدتني في العرض الصور و الأفلام,,1,
وسعره غالي بالنسبه لتجاري,سعر,-1,-1
راائعه جدا وشكلهم حلوو ... بس لو فيه منه 3 متر احلى,شكل,1,1
usb و خفيف على الجهاز .. صورة جيدة جداً .. لا يحتاج خبرة فى التظبيط .. البرامج الاصلية  على اسطوانة,,1,
"منتج سيئ لا يعمل مع الأيفون 5 اس ولا أيباد ميني حيث تظهر رسالة تفيد أن الكيبل  لا يدعم الجهاز (ايفون 5 اس) ولا (ايباد ميني)،حيث تم شراء عدد 2 ولم أستفد منه،وتم إلقائه في القمامة",منتج,-1,-1
حلوة الفكرة يريت لو تجبلناا للجالكسي بنفس النوعية..^^,,1,
تعمل بشكل جيد,,1,
لم أجدها فى أى مكان فى تبوك وأخيراً وجدتها فى سوق.كوم السلعه ممتاذه البائع ممتاز وأنصح بالشراء من عنده,"السلعه،البائع",1,"1, 1"
السلعة سعرها ممتاز وجيدة لا بأس بها,"السلعه،سعر",0,"1, 1"
I thought it would work on car stereo AUX,,1,
جيدة جدا ومفيدة وسعرها مقبول,سعر,1,1
سلعه جدا رائعه وانصح بها لكل من يملك ايباد وايفون,سلعه,1,1
"رائع جدا ،لم اندم لحظة واحدة على شراءه",,1,
"وصلة ممتازة جدا تسمح بتشغيل الفلاش ميموري ع الموبايل ,, ونقل البيانات من الفلاشة إلى الموبايل , ومن الموبايل إلى الفلاشة",وصلة,1,1
مناسب جداً لحفظ مفاتيح جميع أبواب المنزل يتميز بقوة الخشب المصنوع منه ويعيبه فقط عدم امكانية اقفاله بقفل,,1,
حلوه بس سعرها ما يسوا,سعر,-1,-1
جميل جدا الله يعطيك العافية.,,1,
جودة جيدة,جودة,1,1
شكرآ لتعاملكم الراقي وع الهديه اللي جت مع السواره الله يبارك لكم ان شاء الله,تعامل,1,1
مطابق للصورة..جودته جيدة..ووصلت بسرعة,جودة,1,1
رائعة جدا,,1,
عن جد راائعة ... ناعمة ... ذوق رفيع ... تفاصيل دقيقة ... وااو في اللبس ... أعطيها كل النجووم وأكثر,,1,
لا أنصح بشرا  المنتج و ندمت على ذلك,المنتج,-1,-1
مميزة جدا و عصرية .. و الهدايا التي جاءت مع الطلب دليل على رقي الاخ البائع الكريم. و ستكون فرصة جميلة للشراء منه مرة اخرى.,,1,
جميلة جدا و مغلفة  و الاجمل هي الاساور التي جاءت معها. اشكرك اخي الكريم و فرصة سعيدة للشراء معكم مرة اخرى.,الاساور,1,1
جميلة جداً وجذابه ....,,1,
عاديه,,0,
ممتازة وفعالة فى تخفيف آلام العظام والمفاصل,,1,
حميلة جداً,,1,
NIIIIIIIIIIIIIIICE,,1,
اعجبت به,,0,
I recommend this item for a friend.,,1,
جميل وسهل الاستخدام  وسهل الاحتفاظ به,,1,
"بصراحة البائع في غاية الاحترافية سرعة في تجهيز و شحن السلعة , والسلعة تغليفها ممتاز وجديدة كليا .","البائع،السلعة",1,"1, 1"
السعو مبالغ فيه جداا,السعر,1,-1
حلوه و بس فيها واحده متكرره فا هيا كده فيها 4 مش 5 باليتات و لازم مانكير تقيل و مش بينشف بسرعه عشان بنفع معاها,,0,
فكرة رائعة جدا ... سريعة ... للبروفوشنل والمبتدئة والصبايا والأطفال ... فكرة ذكية ... نظافة الصبع على الأصابع ... شكر خاص للبائع الصادق ... وشكر خاص لــ ((( سوق كوم ))),"فكرة،البائع ",1,"1, 1"
من الاشياء الجيدة التي حصلت عليها,الاشياء,1,1
Very Low Material and it is not working well at all,,-1,
gooooooooooooood,,0,
منتج مميزوجميل,منتج,1,1
بأعطيكم تجربتي شوفوا أول ماتشتروا المفرش عرضوه للضوء كم ساعة يكفي لمبة الغرفة بعدها لماتطفوا النور كانك في الفضاء شكل نجوم وعبارة عيون الكون كمان مولعه بصراحة جو رومانسي وخيالي شكرا للبائع وشكرا لسوق كوم,المفرش,1,1
خفيفه جدا لاتقيء من البرد,,-1,
كم ورد في الوصف,,1,
عطر جميل الرائحة,عطر,1,1
#NAME?,,1,
ماتشتغل,,-1,
عمليه جدا  وتسهل علي مستخدمها وضع فرشاته في مكان امن و شكل جميل,شكل,1,1
