Sentences,Aspects,Sentence Sentiment,Aspects Sentiment
الجهاز اصلي ووصلني خلال اربع ايام,الجهاز,0,1
جهاز رائع يمتاز بصوت منخفض وخيارات كثيره للاستخدام,جهاز,1,1
كافة البيانات سليمة والسلعة رائعة جزاكم الله خيرًا,البيانات,-1,1
"السلعة ممتازة, انصح بها",السلعة,1,1
السلعة ممتازة وتستحق الشراء حقيقة .. شاشة واضحة ولمس جيد جداً ..,"السلعة،شاشة",1,"1, 1"
ممتازةالسلعة مطابقة للوصف تماما وتعتبر ممتازة مقارنة بشاشات الملاحة الصينية الاخرى حيث جربت اكثر من واحدة وهذه تعتبر افضلهم وتستاهل المبلغ المدفوع,السلعة,1,1
- إيجابيات و سلبيات جهاز ملاحة 7 بوصة مع خرائط الخليج والاردن و مصر و تركيا  و المغرب و اوروبا بريطانيا  و افريقا:,,1,
يتميز هذا الجهاز بخدمة الاوامر الصوتيه لكن باللغه إلانجليزية .. كما انه لايدعم حركة المرور عن طريق الجهاز مباشرة الا عن طريق ربطه بالهاتف النقال .. الخدمة متوفره فقط لاوربا عن طريق الجهاز فقط,,1,
شاشة متازة انصحكم بقتنائها لفورد تورس 2013 -2015,شاشة,1,1
جهاز جيد بالنسبة لسعره,جهاز,1,1
الجهاز ممتاز .... والبائع يشكر على التعاون ....,الجهاز,1,1
"هذه السلعة ليست عملية أبدا،بل هي أقرب إلى أدوات الزينة منها إلى الأدوات العملية.",السلعة,-1,-1
طقم ممتاز جدا انارة ناعمة جدا في الحديقة تضيف جمالا عند الممرات أو الأحواش,"طقم،انارة",1,"1, 1"
سعر مجنون,سعر,-1,1
مقبول نوعا ماء,,-1,
جودتها عالية ومرنة جدا للاستخدام,جودة,1,1
هل بدة التحكم تشتغل على الكمبيوتر pc,,1,
ده بالرسيفر ولا بدون لل كمبيوتر,,1,
السلعه مطابقه للمواصفات المذكورة عملية وخفيفة الوزن,"السلعه،الوزن",1,"1, 1"
سلعة متناسبه مع سعرها فهي جديده في أسواق الخليج واتمني اجراء التطوير والتحديث عليها حتي يتم الاستفادة منها من قبل اكبر شريحه من الناس,سلعه,1,1
سيئ جدا ولو فيه وصف اكثر من ذلك لكتبته,,-1,
سلعه ممتازة و مواصفاتها عاليه و تتمدد بشكل جيد جدا ولكن هناك بعض التسريب من مكان الربط,"سلعه،مواصفاتها",1,"1,1"
انصح بأقتناء ذلك الخرطوم لانه ضروري للمنزل,الخرطوم,1,1
استعملت المنتج واعجبني في سهولة استعماله وتركيبه ولا ينثني عند السحب ولا يتعقد,المنتج,1,1
سلعه ممتازه جدا جدا جدا جدا خفيفه الوزن الوان جزابه وتحكم ممتاز فى ضخ الماء مما يساعدك فى التكم فى الرش,"سلعه،الوزن،الوان",1,"1, 1, 1"
تقييم خرطوم الماء المتمدد المرن - خفيفه لا تأخذ حيز - سريعة التلف والتمزق - تأخر وصولها الى 14 يوم - على العموم ممتازه نوعا ما و سأشتري آخر قريبا.,خرطوم الماء,1,1
لا انصح بشراء هذا المنتج,,1,
"سلعة ممتازة كما في الوصف, انصح به لاي حديقة حيث ان السعر جيد...","سلعة،السعر",1,"1, 1"
هذة السلعة ممتازة وعملية ولكن فى مصر لن تعثر على المنتج الاصلى ولو عثرت علية هتلقية بضعف التمن ولكن هذة السلعة متوسطة الخامة والسعر معقول,"السلعة،السعر",0,"1, 0"
آلة قلي البيض رائعة ومدهشة جدا وسهلة الاستخدام واقتصادية كنت متردد في شرائها ولكن الان اعجبتني وانصح بشرائها,"آلة قلي البيض،الاستخدام",1,"1, 1"
الطقم كان في غايه الروعه\ والسلعه موافقه للمواصفات واشكركم على الجودة والسرعه في الطلب\ وانصح بالتعامل مع البائع,"الطقم،السلعه",1,"1, 1"
طقم رائع كهدية,طقم,1,1
اعجبني الشكل لكن جودته لاتناسب سعره,جودة,-1,-1
- إيجابيات و سلبيات قطاعة الثوم المبتكرة:,,1,
سيئة جدا جدا,,-1,
آخر فانتازتك,,1,
رائع وسريع,,1,
منتج رائع بالفعل. له اكثر من سنة معي وجودته ثابتة,"منتج،جودة",1,"1, 1"
قطاعه البصل سهله وخفيفه وبتنظف علي طول وشكرا لكل القائمين علي سوق كوم,قطاعه البصل,1,1
ليست حافظه للحراره وليست كما في الصورة,,-1,
ممـــــــــــــــــــــتازة,,1,
ممتازة ورائعه جدا,,1,
السلعة وصلت من البائع سريعاً و هذا شيء جيد و لكن ..,,-1,
"عيار 21 ،طقم كامل من الذهب ،تشكيله مميزه .",تشكيله,1,1
جدا ممتاز وتحفظ الحرارة بشكل ممتاز,,1,
لم استطع استلامها لدواعي السفر,,1,
جودة عالية,,1,
جميله وسلسه عند إستخدامها,,1,
- إيجابيات و سلبيات كوركماز استرا تريو طقم قدور 3 قطع-A1803,,1,
"الصراحة تعبنا من الأكواب التقليدية ،وأنا عندي تجارب كثيرة مع الأكواب سواءا بإنسكابها أو سهولة كسرها  ،لكن مع كونتيقو contigo غييير جربتها والآن عندي أكثر من سنة وبنفس الكفاءة .. وأشتريت لأسرتي منها وكان رأيهم إيجابي عنها .. ومتوفرة بعد بأشكال وألوان جذابة وهذا الشي إلا نبغاه في الأكواب","الأكواب،ألوان،أشكال",1,"1, 1, 1"
منتج يستحق الشراء,منتج,1,1
السلعة جيده وعجبتني كثيرا ما يقلقني كثرة التنبيهات بخصوص الاستعمال,السلعه,0,1
اشتريت 6 حبات هدايا للأقارب.,,1,
الخامة سيئة ولا تعمل,الخامة,-1,-1
سلعه مميزه وجودتها عاليه والتصمميمات مميزه ولا اروع نشكركم علي توفير السلع عالية الجوده وننتظر المزيد,"سلعه،جودة،التصميمات",1,"1, 1, 1"
هي حلوة للحلويات والآيس كريم بس لان حجمها صغير جدا لا تصلح للشوربة,حجم,0,-1
أفضل لو أنها أرخص,,1,
حجمه مناسب والخامة كلها stainless steel  والسعر مناسب,"حجم،الخامة،السعر",1,"1, 1, 1"
حلوة جدا,,1,
سلعة ممتازة ورائعة وعملية جدا وشكلها فخم للضيافه,"سلعة،شكل",1,"1, 1"
اداء الالة رائع جدا وسهل وتقوم بصنع البيتزا بجودة عالية وسرعة,اداء الالة,1,1
انها بلاستيك غير قابلة للكسر بسهولة-- وشكلها المتميز -وسهل التعامل معها- حجمها الصغير- يفضل ان يتوفر منها الاثنا عشر container,"بلاستيك،شكل،التعامل،حجم",1,"1, 1, 1,-1"
#NAME?,,1,
هذه القطاعة لا تعمل بالشكل المطلوب وتركيبتها هشة جدا وغير متماسكة و  بالتجربة لا تستطيع,القطاعة,-1,-1
صاج تحمير السنمبوسة بدون زيت سلعه رائعه   وسهله الاستخدام  وكنت بصراحه ابحث عنها فوجدتها والحمد الله  والله يعطيكم  الف عافيه  على سرعه التوصيل,صاج تحمير السنمبوسة بدون زيت,1,1
خفيفة وصغيرة الحجم وفعالة بشكل كبير خصوصا في الحفلات وأثناء مشاهدة التلفاز,الحجم,1,1
- إيجابيات و سلبيات الة إمتصاص الدهون:,,1,
اواني مطبخ رائعة  حقا سلعة ممتازة .,اواني مطبخ,1,1
حجمها مناسب وتحتفظ بالحراره مده طوييله وتصلح للعائله الصغييره,حجم,1,1
منتج شكله جميل جدا وعملي حتى تقدر تقدمه في وجود ضيف على الغذاء واستخداماته كتيرة,منتج,1,1
ممتازة وتحفظ الكورن فليكس  وفي متناول يد الجميع وحجمها كبير وانصح بشراءها  للناس الذين يفضلون البلاستيك انا عن نفسي افضل البلاستيك لانه سهل في النظافة وامن على الاطفال,"حجم،البلاستيك",1,"1, 1"
غير جيدة,,-1,
سيئة وصغيرة الحجم لا تنفع للبطيخ انصح بعدم شرائها,الحجم,-1,-1
سلعة عملية وممتازة  تختصر مساحة بشكل ملفت ومميز للضيو فك ..وقوية ومتينة ابهرت بعا زةاري ..والمثي  سأل عنها ومن اين  اشتريتها..شكرا جزيلا,سلعة,1,1
"الحقيقة سلاقة البيض مميزة و مريحة ,, و من خلال التجربة من قرأته رأيه واقعا",سلاقة البيض,1,1
أنصح بها لكل الأمهات ولكل العرسان,,1,
جدا سئية ولا يوجد صحة لعنوان السلعة,,-1,
مفيدة جدا في المطبخ وتستاهل سعرها,سعر,1,1
ماهياش قادرة تخدش قشرة البطيخة حتى .. ده غير انها ضعيفة جدا وكانت هتتخلع من بعضها لمجرد الضغط عليها شوية,,-1,
جيد جدا  انا معجب بهذه السلعة وشكرا لكم والأحسن أنها من الستينلز ستيل غير قابلة للصداء,السلعة,1,1
يجب الانتباه فهي تسن السكين والمقص بشكل مقبول لكن الحذر فهي تتحرك من السطح المفروض ان تلتصق به وعلى العموم براي مقبوله.,,-1,
"البلاستيك المصنوعة منه .معاد تصنيعه .كماأني استلمتها مكسورة من الأعلى ,لكنها جميلة وتناسب اطعمة الاطفال .",,-1,
حلوة جدا و عملية و سهلة الاستخدام,,0,
لقد اشتريت هذا السكين من الموقع على أساس أنها تسطيع تقطيع الأطعمة المجمدة بمهارة ولكنني اكتشفت أنها لا تستطيع تقطيع أي شيء حتى الجبنة البيضاء أو الخطروات,السكين,1,-1
المنتج رائع جدا,المنتج,1,1
"سلعة ممتازة   ،  انصح  الجميع  بشرائها ،",سلعة,1,1
شكرا على تعاونكم,,1,
منتج جيد جدا و سهل الاستعمال,منتج,1,1
المنتج عملي جدا والمقاس كبير,المنتج,1,1
اله بطيئه في عمل غزل البنات ولا تعمل غزل النات صح بالنسبه لسعرها,اله,-1,-1
الموتور قوي وسريع,الموتور,-1,1
شكل رائع ويوجد بجوانبها كليبس لتثبيت الغطاء أثناء التنقل عمليه ورائعه,شكل,1,1
تم استلامه من البائع وهو متعطل ولا يعمل نهائياً,,-1,
جملية جدا ومريحة ولكن كنت قد رأيت مثيله لها ولكن بشاحن كهرباء وهذا اجمل واوفر من البطاريات .. تحياتي ..,,0,
جيدة الى حد 70%  وانصح كل من يشتريها بان يتعامل معها برفق حتى تدوم معه وكذلك لكل الاجزاء وخاصة قطاعة الطماطم وفرشة التنظيف,,0,
ممتازة حيث تدخل في عدة استخدامات توليع فحم  وتحمير حلويات وكرملة سكر مع احساس بالامان في استخدامها وتمتاز بالهدوء,,1,
ابتكار جميل لفصل الصفار عن الزلال بطريقه سريعة وسهلة  ممتازة خامة جيده وسهلة الاستعمال,,1,
المنتجات عملية وسهلة الاستخدام,المنتجات,1,1
ممتازة جدا طبق المواصفات المذكورة اشكر البائع على المصداقية,البائع,1,1
السلعة جيدة. المعدن متوسط الجودة ولكن مقبول بالنسبة للسعر. الحجم اصغر مما تبدو عليه في الصورة. تصلح لوصفة كيك صغيرة.,"السلعة،المعدن،الحجم",1,"1, 0, -1"
المنتج رائع جدا,المنتج,1,1
"لا يمكن إستخدامها إلا في قدر مسطح تماما،ويجب أن يكون مستوى إرتفاع الطعام فيه محدد لا يزيد ولا ينقص. كما أن الكثافة إن زادت لا تدور اليد وإن قلت تناثر الطعام!!",,-1,
المنتج روعة,المنتج,1,1
اصغر من الصوره وتغليفه سيء,,-1,
أتمنى أن يكون منها أحجام أكبر لتصبح الفوائد أكثر,,1,
جيد وسهل الاستخدام ارجوا ان يصمد ولا يصاب بعطل,,1,
المنتجات ممتازه جدا وجميله ولا تاخذ حيزا كبيرا في المطبخ,المنتجات,1,1
كنت  اتوقع  انها  اكثر  وزنا,,-1,
شكرا,,1,
الجهاز جداً عملي ووممتاز يوفر عليك والوقت والجهد وسهل الاستخدام أنصح الجميع شراء هذي السلع من واقع تجربتي.,الجهاز,1,1
الاله عملية وافضل ما حببني فيها هو انها تعمل البيض بعدة طرق جميله وسريعه مما ادى الى تنافس اطفالي عليها الذي اعاني من قلة اكلهم بشكل عام.,الاله,1,1
المنتجات عملية وجيدة وسهلة التنظيف,المنتجات,1,1
السلعة ممتازة ولكن التسليم كان متأخرا جدا بعد ستة عشر يوما من الشراء واللون أصفر و ليس أسود كما هو مكتوب في وصف السلعة,"السلعة،التسليم",1,"1, 1"
هى غير عملية على الاطلاق حيث تحتاج ليمون كبير جدا ولا تناسب الدارج من الليمون المصرى ولا انصح بشرائها,,1,
كوب لتحضير العصائر مميز لتحضير العصائر بسرعة وسهولة وانصح بشراء وذلك لسهولة تنظيف الكوب وتحضير العصائر بسرعة,كوب لتحضير العصائر,1,1
لا بأس به,,0,
المنتج رااااائع,المنتج,1,1
انصحً. بها.      والسعر مناسب,السعر,0,1
- إيجابيات و سلبيات سانيب برايت طقم قدور ومقالي 3 قطع ‫‫(أزرق)-BSD07250,,1,
ممتازه نوعا ما,,0,
الصينية صغيرة جدا بالنسبة للسعر,الصينية,-1,-1
قطاعه جيده جدا وعمليه,قطاعه,1,1
جيد وممتاز جدا بس مشكلته في التنظيف فقط.,,1,
ما انصح فيها تمنيت اني ما اشتريتها حاولت اقطع فيها البطاطس حلزونيه لكن ماتعمل بالطريقة الصحيحه رديه الصنع,,-1,
المنتج لا انصح بها ابدا,المنتج,-1,-1
"اعجبتني السلعة ،،رائعة التصميم و الالوان ،الجودة متوسطة","السلعة، التصميم و الالوان،الجودة",1,"1, 1, 0"
رائع لكنه ينقطع بسرعة,,0,
راضي عن المنتج,المنتج,1,0
#NAME?,,1,
حنفية البيبسي ممتازة ورائعة,حنفية البيبسي,1,1
جيده وكذلك السعر مناسب لحجم العلب الموجوده ويمكن التخزين على حسب الاحتياجات او شراء المزيد للمحافظه على الاطعمه,السعر,1,1
الصراحه السلعه جيد وانا اليوم استلمتها وانصح بشرائها واشكر البائع,السلعه,1,1
شكرا لك ع مصداقيتك,,1,
ممتازة وخفيفة الوزن ويوجد مكان لتخزين وحفظ البخور,الوزن,1,1
في الحقيقة منتج ممتاز وتستحق الثناء والاقتناء وقد قمت بشرائها عن طريق موقع سوق كوم  وإن كان هناك تأخير في تسليمها لي ولكنها ممتازة بكب صراحه وبعيد عن أي مجاملة .,"منتج،تسليم",1,"1, -1"
ممتازه وعملية ومتعددة الاستخدام ولاتحتاج الى مساحة كبيرة ولونها مناسب مع ديكور المطبخ واتمنى ان يكون لها مثيل من الالمنيوم او الاستيل,لون,1,1
سلعة جيده جدا وسهلة الاستخدام,سلعه,1,1
نظيفة وجيدة وسهلة التركيب وتمتاز بليونة مريحة في الشراب للعصير البيبسي وازالة الغازات ايضا,,0,
اعجبتني فكرة فصل الأحذية عن حقيبة الملابس اثناء السفر والمحافظ عليها وع نظافتها وسهله في مشاهدة الاحذيه واختيار المطلوب بسهوله,,1,
سلعة جيدة جدا وتخزن اعزكم الله الجزم بشكل مرتب لكن التجميع او التركيب فيه صعوبة,سلعة,0,1
خفيف عملي,,1,
السلعة ممتازة وذات خامة بلاستيكية متينة ترتب الاحذية في شكل انيق ونظيف وﻻ تأخذ حيز كبير حيث يمكن تعليقها خلف اي باب .واشكر البائع على جودة منتجه ومصداقيته في مطابقة المنتج للمواصفات والصورة المرفقة بالسلعة,"السلعة،خامة بلاستيكية،البائع",1,"1, 1, 1"
جيدة والبائع كذلك جيد ويستحق الاشادة,البائع,1,1
#NAME?,,1,
منتج حلو وسهل الاستخدام وغير مكلف بس المشكلة انة مافي طريقة استخدامة,منتج,1,1
جيده والشكل جميل وخفيفة الوزن وعمليه .,"الشكل،الوزن",1,"1, 1"
فكرة جميلة وعمليه وسعرها معقول العيب الوحيد ان خامتها ضعيفة شويه لكن فى المجمل هى جيده ....................,"سعر،خامة",1,"0, -1"
توصيل سريع والبضاعة  مرة ممتازة وصلتني سليمة و مغلفة ونظيفة ولي تعامل معك  مرة أخرى . شكرا لك,توصيل,1,1
السلعة تستاهل اكثر من السعر الي شريتها به وفرت ليي مساحة في شنطة السيارة ونظمت الاغراض الموجودة,السلعة,1,1
١- التغليف جيد ولكن وصلت متظرره ومطعجة لضعف الخامة,,-1,
"السلعة ممتازة للغاية ومصنوعة من مواد عالية الجودة, كما أنها عملية وسريعة في غلي المياه وسعرها ممتاز مقابل الجودة العالية وأنا سعيد جدا بها .. وانا أنصح الجميع بأقتناء السلعة لأنها توفر الوقت خاصة قبل الأنطلاق للدوام.","السلعة،سعر",1,"1, 1"
جيده جدأ وممتازة وسماكة الارجل وقوة الدعمات لها وسلاسة القماش واتمنى ان نرى افضل واحسن ادا كان لديكم,,1,
اختراع ذكي و سهل ورخيص ويمكنك من الاستغناء عن اختبارات المختبرات الكبيرة,,1,
ممتازة سهلة التركيب ....,,1,
افضل نوعيه وشكلها جميل,شكل,1,1
المناديل لاتقوم بفائدتها.. تترك بقعة بيضاء ع الملابس ورائحتها سيئة جدا,"المناديل،رائحة",-1,"-1, 1"
رديئه جدا جدا,,-1,
قمت بطلبها مرتين وفي المره الاولى تم ارجاعها وذلك لارسالهم منتج تنظيم شنط خلف الباب,,-1,
ممتازه جدا يمنع دخول الاتربه والحشرات ويحمي المنزل من الاوساخ وسهل الإستخدام  وانصح الجميع باستخدامه,,1,
الخامة خفيفة ولابد استعمالها بحذر,الخامة,1,-1
السلعة بطيئة غير متزنة تتفكك بسرعة بطيئة غير عملية,السلعة,-1,-1
خامة جيدة ومتينة والتصميم جذاب جداا والسعر مناسب جدا وفترة التوصيل والشحن ممتازة وتغليف السلعة جيد,"خامة،التصميم،السعر،التوصيل و الشحن،تغليف السلعة",1,"1, 1, 1, 1, 1"
خفيفة و سهلة الاستخدام و تنظف جميع الاسطح. يمكن استخدامها في الاسطح المبللة لكن الجهاز لايمكن وضعه داخل الماء. تحتاج لبطارية لايمكن وصلها بالكهرباء.,,1,
هذه السلعه كنت افكر انها جيده ولاكن العكس سئيه وكنت افكر في اقتنائها ولاكن تم ارجاعها للعميل لانها لاتعمل,السلعه,-1,-1
صغيرة جدا ولا تأخذ مساحة في الحقيبه. سهلة الطي وعملية. الوانها رائعه. مصنوعه من البلاستك لايمكن وضع الملابس الثقيلة جدا عليها.,"الوان،الملابس",1,"1, -1"
رااائعة وعملية,,1,
خصائص المنتج جيدة لكن جودته سيئة جدا ولا انصح بإقتنائه,"خصائص المنتج،جودة",-1,"1, -1"
المضخة لا تعمل اذا انا اشترى مروحه وليس مبرد هواء وتقدمت بشكوه ولم يهتم احد بي حتى الان فقمت بتصليحة على حسابى لذا لا انصح احد بشراؤه,المضخة,-1,-1
خفيفة عملية تعمل بكفاءة عالية تصميم متقدم,,1,
"الممسحة ممتازة, والسعر معقول","الممسحة،السعر",1,"1, 0"
أنصح بها,,1,
"السلعة جيدة جدا ،واستعمالها مفيد ،قد أقدتي قطعة أخرى منها ،إن حصلت عليها بنفس السعر الأول",السلعة,1,1
فكرة رائعة وتفي بالغرض تماماً,,1,
روعه صراحة وخصوصا فتحات الشحن يواس بي,,1,
للاستعمال المنزلى والسيارة والحديقة,,1,
رائعة وخفيفة وسرييعة في الاستعمال انصح بأستخدامها ومحافظ في شكلها الى ان وصلت,,1,
السلعة ممتازه جدآجدآ وأنصح الجميع بشراء هذا المنتج لانه يوفر عليك عناء الخروج في الشمس وفي حال وجودك في الشقة فهو مناسب جدآ لك  وفي حال سقوط المطر فهو مناسب جدآ جدآ,السلعة,1,1
"السلعة جميلة جدا , لكن أنصح البائع بالاتصال على المشتري والتواصل معه بشأن اختيار اللون المناسب للمشتري",السلعة,1,1
عملية و خفيفة الوزن ومتوسطة الحجم . لاتأخذ حيز من المكان تصلح لعائلة صغيرة . للاسف غير مقاومة للصدء.,"الوزن،الحجم",1,"1, 0"
"أقلام رائعة جداً لتغطية خدوش الأثاث الخشبي والأرضيات , أنصح الجميع باستعمالها.",أقلام,1,1
مريحة في الاستخدام وسهلة التنظييف,,1,
"فكرة جديدة ورائعة وبالفعل تم تطويرها بحيث لاتنتقل الحرارة الى اليد أثناء التشغيل ولكن يوجد عيب كبير في المنتج وهو أنه في حالة تشغيله لفترة طويلة متواصلة سرعان مايتمزق الغطاء البلاستيكي العلوي وكذلك القاعدة البلاستيكية بسبب الحرارة،وكذلك يوجد صعوبة في خروج الدخان من الاعلى بسبب وجود سدادة داخلية لاأعلم مافائدتها وللعلم فقد قمت بإزالتها مؤخرا.",المنتج,-1,-1
الله يعطيك العافية,,0,
جيد بالنسبه للبطاريات,,1,
سلعة فعلا مطورة ومعالج فيها سلبيات الموديلات الأخرى سواء من السخونة والتحمل والأمان,سلعة,1,1
جيدة نوعا ما,,-1,
جيده ومناسه,,1,
ممتازة أعجبتني كثيراً لكن صلة الوصل بين القاعدة والذراع ضعيفة فانكسرت الممسحة بسرعة,صلة الوصل,1,-1
السعر اعلى من السوق,السعر,0,-1
سلعة ممتازة وجسم قوى وتثبيت قوى على سطح املس وذراع معدنى يزيدها قوة,"سلعة،جسم،تثبيت",1,"1, 1, 1"
